titulo,precio,ambientes,banos,metros,zona,ciudad,fecha_scraping,precio_m2
Casa En Venta 4 Amb. Pilar,125000,4,2,175,GBA Norte,Pilar,2025-12-17,714
Dúplex De 3 Amb Con Jardín Y Cochera A Estrenar- .,130000,3,2,66,GBA Norte,Pilar,2025-12-17,1970
Casa En Venta San Ramon Pilar Del Este - 450m2 #id 16673,149000,4,1,113,GBA Norte,Pilar,2025-12-17,1319
Venta Casa En Barrio Santa Emilia Pilar Del Este,150000,4,2,113,GBA Norte,Pilar,2025-12-17,1327
"Casa En Venta En Barrio Privado Santa Emilia, Pilar Del Este",150000,4,3,135,GBA Norte,Pilar,2025-12-17,1111
Emprendimiento Pilar Del Este,153000,3,3,107,GBA Norte,Pilar,2025-12-17,1430
Casa En Venta Palmas Del Sol - Pilar 2 Dormitorios Con Jardín Apto Crédito,158000,3,1,76,GBA Norte,Pilar,2025-12-17,2079
"Casa Dúplex  En Venta En Springpark Pilar, Pilar, G.b.a. Zona Norte",165000,4,3,127,GBA Norte,Pilar,2025-12-17,1299
Casa En Los Arces,175000,4,2,100,GBA Norte,Pilar,2025-12-17,1750
"Dueño Vende Casa 5 Ambientes Con Pileta. Barrio Cerrado California Village, Pilar, Zona Norte",180000,6,2,116,GBA Norte,Pilar,2025-12-17,1552
Venta O Alquiler Depto 2 Amb Planta Baja Con Jardín En Pilará,180000,2,1,53,GBA Norte,Pilar,2025-12-17,3396
"Casa  En Venta En San Ramón, Pilar Del Este, Pilar",195000,4,3,150,GBA Norte,Pilar,2025-12-17,1300
"Venta De Casa En Country Boca Raton, Pilar  - 4 Dormitorios Amplios Y Luminosos - 4 Baños Modernos Y Bien Equipados - Living Comedor Amplio Con Espacio Para Disfrutar En Familia - Quincho Incorporado",198000,4,4,327,GBA Norte,Pilar,2025-12-17,606
Casa En Venta Con Renta -  Barrio Privado Bermudas,198000,4,3,160,GBA Norte,Pilar,2025-12-17,1238
"Casa  En Venta En Santa Guadalupe, Pilar, G.b.a. Zona Norte",199950,4,2,175,GBA Norte,Pilar,2025-12-17,1143
Dueño Directo. Country Champagñat. Pilar Centro,205000,3,3,146,GBA Norte,Pilar,2025-12-17,1404
Casa A Estrenar En San Sebastián  Área 12 | Lote 963 M2 | Calidad + Diseño,223000,4,3,162,GBA Norte,Pilar,2025-12-17,1377
Casa En Venta De 4 Ambientes En Barrio Privado Santo Tomas,225000,5,3,145,GBA Norte,Pilar,2025-12-17,1552
"Posibilidad De Venderse Amueblada, Barrio Santa Elena, Pilar",238000,4,3,130,GBA Norte,Pilar,2025-12-17,1831
"Dueño Directo Vende, Pilar Del Lago (pilar)",265000,6,3,280,GBA Norte,Pilar,2025-12-17,946
"San Sebastian Área 8 Casa A La Laguna!!! A Estrenar, Terminaciones De Calidad, 4 Habitaciones 4 Baños Dueño Directo Sin Comisiones!!",279000,5,4,193,GBA Norte,Pilar,2025-12-17,1446
"Casa En Venta En Barrio Sausalito De 314 Mts En Lote De 800 Mts Con Orientacion Norte, De 3 Años De Antiguedad, Escriturada Y Apto Credito",290000,7,4,314,GBA Norte,Pilar,2025-12-17,924
Casa En Sausalito - Venta Por Dueño Directo,290000,4,3,200,GBA Norte,Pilar,2025-12-17,1450
Venta /alquiler Casa En C.c. Pilar Del Lago   Dueño Directo,290000,5,4,226,GBA Norte,Pilar,2025-12-17,1283
"Casa En Venta En Chacras Del Ocho, Al Lado De Pilará",290000,2,2,154,GBA Norte,Pilar,2025-12-17,1883
Dueño Directo Excelente Oportunidad Pilar Del Este,340000,5,4,200,GBA Norte,Pilar,2025-12-17,1700
Venta Casa En Obra Avanzada 4 Ambientes En Azzurra Tortugas,345000,4,3,187,GBA Norte,Pilar,2025-12-17,1845
"Casa Impecable Estado En Country, Desarrollada En 2 Plantas Con Piscina. Terreno 800 M2.",350000,7,4,217,GBA Norte,Pilar,2025-12-17,1613
"Casa En Venta 4 Ambientes En Pilará, La Calesa. Con Jardín Y Pileta",430000,4,2,205,GBA Norte,Pilar,2025-12-17,2098
"Casa Venta 4 Ambientes En Ayres De Pilar Lote De 886,72 M2",490000,4,3,178,GBA Norte,Pilar,2025-12-17,2753
"Casa En Venta En Lagoon Pilar (5 Dormitorios, 6 Baños)",505000,5,6,315,GBA Norte,Pilar,2025-12-17,1603
"Casa En Ayres De Pilar. 6 Ambientes, 4 Baños, Toilette ...",595000,5,4,257,GBA Norte,Pilar,2025-12-17,2315
Casa 3 Dormitorios - Diseño - Pilará,680000,4,3,260,GBA Norte,Pilar,2025-12-17,2615
Casa En Venta En Ayres De Pilar Estilo Toscano,690000,6,5,288,GBA Norte,Pilar,2025-12-17,2396
Casa En Venta En Highland Park Country Club,760000,7,6,600,GBA Norte,Pilar,2025-12-17,1267
Venta Casa 4 Dormitorios En Martindale Cc,1050000,7,3,471,GBA Norte,Pilar,2025-12-17,2229
Casa En Venta En Pilara Sobre Golf - La Diligencia - Pilara - Urdapilleta Propiedades,2400000,10,6,532,GBA Norte,Pilar,2025-12-17,4511
"Casa  En Venta En Zona Delta, Tigre, G.b.a. Zona Norte",45000,3,1,58,GBA Norte,San Fernando,2025-12-17,776
Venta Casa 3 Ambientes Y Dpto En Fondo Victoria,119000,3,2,144,GBA Norte,San Fernando,2025-12-17,826
Casa En Venta En San Fernando,120000,3,2,84,GBA Norte,San Fernando,2025-12-17,1429
Ph 3 Ambientes En San Fernando,125000,3,1,104,GBA Norte,San Fernando,2025-12-17,1202
"Casa Venta, Virreyes, 5 Ambientes, Jardín",138000,5,2,140,GBA Norte,San Fernando,2025-12-17,986
Duplex  En San Fernando Con Jardín Y Cochera Triple A La Venta!,140000,3,2,90,GBA Norte,San Fernando,2025-12-17,1556
Casa En  A La Venta En San Fernando!,141000,3,1,90,GBA Norte,San Fernando,2025-12-17,1567
Casa Con Jardin A La Venta,155000,4,1,106,GBA Norte,San Fernando,2025-12-17,1462
Casa - San Fernando - En Venta,155000,4,2,109,GBA Norte,San Fernando,2025-12-17,1422
Venta  Casa 4 Ambientes Con Gran Potencial Comercial  San Fernando,165000,4,1,120,GBA Norte,San Fernando,2025-12-17,1375
Casa En  Venta En San Fernando Apto Crédito,180000,6,3,189,GBA Norte,San Fernando,2025-12-17,952
Inversión En San Fernando: Casa Principal   Depto Independiente Al Frente,190000,5,2,144,GBA Norte,San Fernando,2025-12-17,1319
Casa En Venta San Fernando,200000,4,1,116,GBA Norte,San Fernando,2025-12-17,1724
Casa En Venta En Victoria,205000,5,2,155,GBA Norte,San Fernando,2025-12-17,1323
"Venta Casa 4 Ambientes, Victoria, Jardin Y Cochera",210000,3,2,169,GBA Norte,San Fernando,2025-12-17,1243
"Venta - Casa 4 Ambientes - Rivadavia 1400, San Fernando.",215000,4,2,114,GBA Norte,San Fernando,2025-12-17,1886
Venta Casa Con Locales Comerciales San Fernando,220000,4,2,176,GBA Norte,San Fernando,2025-12-17,1250
Tu Próximo Hogar En Arenales Al 1400  4 Ambientes Con Jardín Y Pileta,229990,4,1,114,GBA Norte,San Fernando,2025-12-17,2017
"Casa En Venta, De Libertador Al Rio., San Fernando",240000,4,2,144,GBA Norte,San Fernando,2025-12-17,1667
Casa A La Venta En San Fernando Sobre Amplio Terreno,240000,4,1,180,GBA Norte,San Fernando,2025-12-17,1333
Casa En  Venta En Victoria A Modernizar,250000,4,1,200,GBA Norte,San Fernando,2025-12-17,1250
Casa En Venta En Victoria!,255000,5,1,161,GBA Norte,San Fernando,2025-12-17,1584
Venta Encantadora Casa/galpon Con Pileta,260000,5,2,220,GBA Norte,San Fernando,2025-12-17,1182
Venta - Triplex De 4 Ambientes - Jardín - Pileta - Parrilla - San Fernando,265000,4,3,137,GBA Norte,San Fernando,2025-12-17,1934
"Casa  En Venta En San Fernando, G.b.a. Zona Norte, Argentina",270000,4,2,139,GBA Norte,San Fernando,2025-12-17,1942
Casa Con Jardín Y Pileta A La Venta En San Fernando.,275000,5,3,203,GBA Norte,San Fernando,2025-12-17,1355
Casa En  Venta En Victoria!,280000,4,2,177,GBA Norte,San Fernando,2025-12-17,1582
Venta/casa 5 Ambientes/san Fernando/jardin/quincho,285000,5,3,249,GBA Norte,San Fernando,2025-12-17,1145
Casa Restaurada Estilo Inglés En San Fernando  Ideal Vivienda O Emprendimiento,290000,8,4,200,GBA Norte,San Fernando,2025-12-17,1450
Casa En Venta En Punta Chica!,290000,5,2,120,GBA Norte,San Fernando,2025-12-17,2417
Casa - Vict.-b.centro,295000,6,3,178,GBA Norte,San Fernando,2025-12-17,1657
"Venta Casa 5 Ambientes Victoria, San Fernando, Pba",295000,5,1,201,GBA Norte,San Fernando,2025-12-17,1468
Casa En  Venta Para Refaccionar En Punta Chica,320000,5,2,128,GBA Norte,San Fernando,2025-12-17,2500
Casa En Venta Con Amplio Terreno En San Fernando,325000,3,3,197,GBA Norte,San Fernando,2025-12-17,1650
Los Sauces  San Fernando,370000,5,3,303,GBA Norte,San Fernando,2025-12-17,1221
Casa A Reciclar Con Doble Lote En El Alto De Punta Chica,395000,6,3,250,GBA Norte,San Fernando,2025-12-17,1580
Casa Venta San Fernando - 6 Ambientes,420000,6,3,168,GBA Norte,San Fernando,2025-12-17,2500
Casa En  Venta En Victoria,465000,5,5,238,GBA Norte,San Fernando,2025-12-17,1954
Impecable Casa En Barrio Privado La Chacra,480000,6,2,200,GBA Norte,San Fernando,2025-12-17,2400
Venta Casa 5 Ambientes Barrio Cerrado La Damasia Piscina,650000,5,3,181,GBA Norte,San Fernando,2025-12-17,3591
"Imponente Chalet En San Fernando, Calle Necochea, Barrio Santa Clara",680000,10,5,500,GBA Norte,San Fernando,2025-12-17,1360
Casa En Venta En Marinas Del Sol,1100000,8,4,416,GBA Norte,San Fernando,2025-12-17,2644
"Casa En Venta San Fernando, Muy Buena, Super Moderna.",1149000,5,2,455,GBA Norte,San Fernando,2025-12-17,2525
Casa En Venta En Punta Chica,1149000,5,3,457,GBA Norte,San Fernando,2025-12-17,2514
Venta Casa 7 Amb Cocheras Amarra San Fernando San Isidro Marina Del Sol,1180000,6,4,407,GBA Norte,San Fernando,2025-12-17,2899
"Casa  En Venta En Marina Del Sol, San Fernando, G.b.a. Zona Norte",1400000,6,4,491,GBA Norte,San Fernando,2025-12-17,2851
Exelente Propiedad Pilar Dueño Directo Zona Norte Barrio Cerrado Doy Facilidades De Pago,100000,4,2,220,GBA Norte,San Isidro,2025-12-17,455
"Casa Ph En Venta En Villa Adelina, 3 Ambientes, Patio, Cochera. Apto Crédito.",105000,3,1,80,GBA Norte,San Isidro,2025-12-17,1312
Casa 3 Ambientes Sobre Lote De 420m2  - Villa Adelina,140000,3,1,105,GBA Norte,San Isidro,2025-12-17,1333
"Beccar  Casa Amplia Con 3 Habitaciones, Quincho Y Parrilla",149900,5,2,118,GBA Norte,San Isidro,2025-12-17,1270
Casa.2 Dormitorios.julian Navarro Al 2900.beccar,155000,3,1,87,GBA Norte,San Isidro,2025-12-17,1782
Dos Casas - Ideal Residencia Estudiantil - Oportunidad,170000,8,2,131,GBA Norte,San Isidro,2025-12-17,1298
"Venta - Casa Multifamiliar 4/cuatro Ambientes, Cochera - Villa Adelina, San Isidro",170000,4,2,220,GBA Norte,San Isidro,2025-12-17,773
"Venta Casa 4 Ambientes Beccar Alto, Una Planta Con Jardin",180000,4,2,130,GBA Norte,San Isidro,2025-12-17,1385
Casa De 2 Plantas Con Jardín En Venta En Villa Adelina,180000,4,2,140,GBA Norte,San Isidro,2025-12-17,1286
Ph En Venta 3 Ambientes,189000,3,2,116,GBA Norte,San Isidro,2025-12-17,1629
Casa De 2 Plantas Con Jardin A La Venta / Boulogne - San Isidro,199000,4,2,150,GBA Norte,San Isidro,2025-12-17,1327
"Casa En Venta Sobre Lote Propio En Acassuso, San Isidro!",200000,4,1,64,GBA Norte,San Isidro,2025-12-17,3125
Casa En Venta En Villa Adelina Apto Crédito,205000,6,3,216,GBA Norte,San Isidro,2025-12-17,949
Casa En Beccar,205000,5,2,180,GBA Norte,San Isidro,2025-12-17,1139
Casa En  Venta Acassuso,235000,3,2,97,GBA Norte,San Isidro,2025-12-17,2423
Casa En Venta En Martinez C/pileta Sobre Lote Prop,255000,7,2,130,GBA Norte,San Isidro,2025-12-17,1962
Casa De 4 Ambientes Con Dos Cocheras En Venta En Martinez,270000,4,2,174,GBA Norte,San Isidro,2025-12-17,1552
"Casa En Venta En Béccar, San Isidro Con Terraza",295000,4,1,135,GBA Norte,San Isidro,2025-12-17,2185
Chalet 240 M² En Martínez - 5 Dorm - Con Gran Jardín Y Pileta,330000,7,4,242,GBA Norte,San Isidro,2025-12-17,1364
Casa - San Isidro,350000,3,1,165,GBA Norte,San Isidro,2025-12-17,2121
"Dúplex De 6 Ambientes En Venta    Playroom, En Martínez.",350000,6,2,209,GBA Norte,San Isidro,2025-12-17,1675
Casa En Venta En Martínez,379000,5,5,260,GBA Norte,San Isidro,2025-12-17,1458
Venta Casa Townhouse 5 Ambientes Complejo Cerrado San Isidro,380000,5,3,157,GBA Norte,San Isidro,2025-12-17,2420
Excelente Chalet  6amb En 3 Plantas Con Jardín Y Piscina - Martínez,380000,6,3,240,GBA Norte,San Isidro,2025-12-17,1583
Casa En Venta - San Isidro - Lomas De San Isidro - 3 Dormitorios (1 En Suite) - Jardín - Garage,399000,6,2,182,GBA Norte,San Isidro,2025-12-17,2192
Casa En Venta La Merced Lomas De San Isidro,430000,4,2,221,GBA Norte,San Isidro,2025-12-17,1946
"Sensacional Casa Antigua En Pleno Martinez Con Jardin, Piscina Y Cerca De Todo.",450000,8,5,277,GBA Norte,San Isidro,2025-12-17,1625
"Casa En Venta En San Isidro, Frente Al Hipódromo Oportunidad!!",465000,5,3,262,GBA Norte,San Isidro,2025-12-17,1775
Casa A La Venta En Impecable Estado En El Barrio Las Carreras,478000,6,5,280,GBA Norte,San Isidro,2025-12-17,1707
Casa - Eucalis La Horqueta,507000,4,2,175,GBA Norte,San Isidro,2025-12-17,2897
Casa - Acassuso,530000,5,3,332,GBA Norte,San Isidro,2025-12-17,1596
Venta Casa 6 Ambientes Beccar Libertador Con Pileta 1 Planta,550000,5,2,207,GBA Norte,San Isidro,2025-12-17,2657
Casa En Beccar-vias/libert.,610000,5,4,289,GBA Norte,San Isidro,2025-12-17,2111
Casa En Venta De 7 Ambientes En El Bajo De San Isidro,640000,7,3,283,GBA Norte,San Isidro,2025-12-17,2261
"Lindísima Casa Amplia Y Luminosa En San Isidro Catedral, Acceso Por Pedro De Mendoza Y España, 200 Metros De Libertador Al Río, 361m2 Cubiertos, Terreno De 600m2, Seguridad Las 24 Horas, Dueño Directo",700000,7,5,361,GBA Norte,San Isidro,2025-12-17,1939
Espectacular Casa En Martinez Con Jardin Y Pileta,720000,5,4,515,GBA Norte,San Isidro,2025-12-17,1398
Casa En Venta 4 Dormitorios - Barrio Semi Cerrado - Zona Santa Rita San Isidro,765000,6,3,240,GBA Norte,San Isidro,2025-12-17,3188
Importante Casa En El  Corazón De Santa Rita Lomas De San Isidro. Dueño Financia,790000,12,6,350,GBA Norte,San Isidro,2025-12-17,2257
Venta Casa Con Jardín Y Pileta Martinez,830000,7,3,340,GBA Norte,San Isidro,2025-12-17,2441
Casa En Venta En El Corazón De La Horqueta,890000,6,4,385,GBA Norte,San Isidro,2025-12-17,2312
Venta Casa Con Jardin Pileta Parrilla Y 5 Dormitorios,950000,6,6,440,GBA Norte,San Isidro,2025-12-17,2159
Casa En Venta En Exclusiva Zona Residencial En Acassuso,980000,6,7,428,GBA Norte,San Isidro,2025-12-17,2290
"Venta Casa Barrio Cerrado La Horqueta, San Isidro",990000,9,3,381,GBA Norte,San Isidro,2025-12-17,2598
Casa - Mart.-vias/libert.,1260000,5,6,660,GBA Norte,San Isidro,2025-12-17,1909
Casa En Venta  5 Ambientes Lomas De San Isidro,1350000,5,3,600,GBA Norte,San Isidro,2025-12-17,2250
Casa En Venta En San Miguel Con Jardín,56000,3,1,70,GBA Norte,San Miguel,2025-12-17,800
Casa Con Hermoso Terreno En San Miguel - Sobre Asfalto,77000,3,1,65,GBA Norte,San Miguel,2025-12-17,1185
Casa De 540 Metros En San Miguel,78000,2,3,380,GBA Norte,San Miguel,2025-12-17,205
Venta De Duplex En San Miguel,79900,4,2,75,GBA Norte,San Miguel,2025-12-17,1065
Casa Con Quincho Y Gran Parque Sobre Doble Lote  Más De 2.700 M² En San Miguel,82000,6,2,140,GBA Norte,San Miguel,2025-12-17,586
Casa En Venta En Muñiz,95000,5,3,140,GBA Norte,San Miguel,2025-12-17,679
"Casa En Venta San Miguel , Buenos Aires",108000,3,1,111,GBA Norte,San Miguel,2025-12-17,973
Venta Casa 3 Amb Bella Vista + Locales +dpto 2 Amb,110000,5,2,202,GBA Norte,San Miguel,2025-12-17,545
Venta De Duplex En Muñiz A Estrenar,116000,3,2,73,GBA Norte,San Miguel,2025-12-17,1589
Casa A Reciclar O Demoler A Mts De Estación Muñiz,120000,5,2,130,GBA Norte,San Miguel,2025-12-17,923
Venta Casa En Dos Plantas ( Centro De San Miguel),130000,6,2,120,GBA Norte,San Miguel,2025-12-17,1083
Casa En Venta Bella Vista Apta Crédito,135000,4,1,135,GBA Norte,San Miguel,2025-12-17,1000
Glm. Casa Triplex Venta De 4 Ambientes - San Miguel,138000,4,1,105,GBA Norte,San Miguel,2025-12-17,1314
Venta Casa 4 Amb Bella Vista Apta Credito,145000,4,2,160,GBA Norte,San Miguel,2025-12-17,906
"Venta Casa , Muñiz , Apta Crédito ( San Miguel)",149700,3,1,139,GBA Norte,San Miguel,2025-12-17,1077
Casa En Venta Bella Vista 4 Ambientes Con Pileta,159000,4,1,125,GBA Norte,San Miguel,2025-12-17,1272
Casa San Miguel De Ghiso . Oportunidad.,165000,5,3,160,GBA Norte,San Miguel,2025-12-17,1031
Casa En Bella Vista En Venta,175000,3,3,206,GBA Norte,San Miguel,2025-12-17,850
"Casa Chalet  En Venta En San Miguel, G.b.a. Zona Norte, Argentina",180000,4,3,120,GBA Norte,San Miguel,2025-12-17,1500
Increíble Casa De 3 Ambientes En San Miguel,187000,3,1,160,GBA Norte,San Miguel,2025-12-17,1169
"Venta Casa De Siete Ambientes Con Jardín, Pileta, Garaje Y Depósito En Bella Vista",218000,7,3,209,GBA Norte,San Miguel,2025-12-17,1043
Casa Venta Cercano A Estación San Miguel,240000,7,4,205,GBA Norte,San Miguel,2025-12-17,1171
"Casa Barrio Con Portón Venta, Bella Vista",259000,4,2,170,GBA Norte,San Miguel,2025-12-17,1524
En Venta Casa Con Pileta  Lote De 1470m2 Bº Bello Horizonte,280000,6,4,220,GBA Norte,San Miguel,2025-12-17,1273
Venta De Casa Barrio Cerrado Apta Credito En Bella Vista,282000,3,1,101,GBA Norte,San Miguel,2025-12-17,2792
Venta Casa Con 2 Locales  Bella Vista,290000,3,2,304,GBA Norte,San Miguel,2025-12-17,954
Casa En San Miguel,290000,4,2,450,GBA Norte,San Miguel,2025-12-17,644
Venta Casa 4 Ambientes Barrio Cerrado San Miguel,290000,4,3,192,GBA Norte,San Miguel,2025-12-17,1510
"Apto Crédito - Venta Casa 5 Ambientes Doble Lote, Pileta Y Ascensor -  Country San Miguel De Ghiso",295000,5,3,326,GBA Norte,San Miguel,2025-12-17,905
"Venta De Casa En Bella Vista, 6 Ambientes",299000,6,3,230,GBA Norte,San Miguel,2025-12-17,1300
Casa En Muñiz,315000,6,3,191,GBA Norte,San Miguel,2025-12-17,1649
Casa En Barrio Privado La Araucaria Bella Vista,320000,4,2,181,GBA Norte,San Miguel,2025-12-17,1768
Casa En Venta Barrio Cerrado Pato Verde Muñiz 6 Ambientes,326000,3,2,183,GBA Norte,San Miguel,2025-12-17,1781
Chalet En Venta En Country San Miguel De Ghiso.,330000,6,3,250,GBA Norte,San Miguel,2025-12-17,1320
"Casa En Venta, Barrio El Portal Del Sol. San Miguel.",340000,4,3,300,GBA Norte,San Miguel,2025-12-17,1133
"Casa Venta 7 Ambientes Con Porton, Jardín, Pileta, Quincho, Parrilla, Barrio Las Palmas, San Miguel.",396000,7,3,324,GBA Norte,San Miguel,2025-12-17,1222
"Venta Casa, Barrio Cerrado Las Acacias, Muñiz. 7 Ambientes",399000,7,4,264,GBA Norte,San Miguel,2025-12-17,1511
Venta Casa A Estrenar Village Joven Bella Vista,435000,4,3,217,GBA Norte,San Miguel,2025-12-17,2005
Venta De Casa A Estrenar En Barrio Cerrado Village Joven,470000,5,4,270,GBA Norte,San Miguel,2025-12-17,1741
Casa En Venta Barrio Cerrado  Bella Vista San Miguel De Ghiso,485000,4,3,300,GBA Norte,San Miguel,2025-12-17,1617
Venta De Casa 8 Ambientes En Bella Vista Chico,730000,8,4,334,GBA Norte,San Miguel,2025-12-17,2186
Casa En Venta En Buenos Aires Golf,750000,5,4,400,GBA Norte,San Miguel,2025-12-17,1875
Ram. Venta De 2 Casas En Bella Vista,950000,6,3,360,GBA Norte,San Miguel,2025-12-17,2639
"Venta De Casa 6 Ambientes Barrio Cerrado Buenos Aires Golf En Bella Vista, San Miguel",1350000,6,5,650,GBA Norte,San Miguel,2025-12-17,2077
Casa 6 Ambientes En Venta Buenos Aires Golf Bella Vista Apta Financ,1700000,6,6,600,GBA Norte,San Miguel,2025-12-17,2833
Vendo Casa En El Delta De Material Con Amarra Dueño Directo A 30 Minutos De Dique Lujan En Lancha La Casa Está Impecableee Nada Por Hacerle Puedo Tomar En Parte De Pago Autos Camionmeta O Lancha,44000,3,1,55,GBA Norte,Tigre,2025-12-17,800
Cabaña En Venta Arroyo Abra Vieja Primera Sección Del Delta Tigre,48000,2,1,55,GBA Norte,Tigre,2025-12-17,873
Casa En Venta Delta Zona Dique Lujan,65000,3,1,72,GBA Norte,Tigre,2025-12-17,903
Casa Delta Zona Canal Del Este A Estrenar,79000,2,2,85,GBA Norte,Tigre,2025-12-17,929
Isla Tigre Casa En Venta Primera Sección Islas Del Delta Tigre Sobre Arroyo Espera Dueño Directo,92000,3,1,55,GBA Norte,Tigre,2025-12-17,1673
"Casa En Venta En Altos Del Encuentro, Tigre",95000,3,1,74,GBA Norte,Tigre,2025-12-17,1284
"Casa En El Delta Del Tigre En Un Entorno Mágico, Seguro Y Pacífico - 1ra Sección - Arroyo Arroyón - Barrio El Esloveno",110000,3,1,75,GBA Norte,Tigre,2025-12-17,1467
Casa En Venta En Don Torcuato 3 Dorm Jardin Pileta,115000,4,1,100,GBA Norte,Tigre,2025-12-17,1150
Casa 2 Plantas 5 Dorm. General Pacheco-venta Pacheco Sur,135000,6,2,200,GBA Norte,Tigre,2025-12-17,675
"Casa En Isla, Frente Al Continente, Con Servicio De Cruce (demora 5 Minutos), Estacionamiento Y Canal Privado",139000,3,2,85,GBA Norte,Tigre,2025-12-17,1635
Casa 4 Amb 2 Baños Sobre Avenida Centro Tigre  Financio,180000,4,2,180,GBA Norte,Tigre,2025-12-17,1000
"Triplex Venta Tigre, Barrio Pinar De Tigre, Acceso Tigre",180000,4,2,125,GBA Norte,Tigre,2025-12-17,1440
Venta Casa 2 Ambientes Galeria Parrilla Muelle Privado - Santa Monica,185000,2,1,60,GBA Norte,Tigre,2025-12-17,3083
"Triplex Tipo  Casa, En Tigre En Venta",243000,4,2,105,GBA Norte,Tigre,2025-12-17,2314
Casa En Venta En Nordelta,250000,4,2,133,GBA Norte,Tigre,2025-12-17,1880
"Venta De Casa Y Cabañas En Primera Sección De Isla Del Delta, Tigre, Con Escritura.",280000,4,3,500,GBA Norte,Tigre,2025-12-17,560
"Casa  En Venta En Santa Ana, Villanueva, Tigre",398000,6,4,280,GBA Norte,Tigre,2025-12-17,1421
Venta Casa 3 Dormitorios Valle Claro Benavidez,430000,6,3,251,GBA Norte,Tigre,2025-12-17,1713
"Casa En Venta En Laguna Grande, Villanueva",459000,6,3,192,GBA Norte,Tigre,2025-12-17,2391
Venta Casa En Los Sauces Nordelta,485000,6,4,226,GBA Norte,Tigre,2025-12-17,2146
Casas En Venta Santa Ana Villanueva Tigre Con Piscina Laguna,495000,5,3,240,GBA Norte,Tigre,2025-12-17,2062
Casa En Venta Barrio Vistas Puertos Escobar,520000,5,4,267,GBA Norte,Tigre,2025-12-17,1948
Venta De Casa Con Amarra!  Nordelta,550000,5,3,246,GBA Norte,Tigre,2025-12-17,2236
"Dueño Directo Vende Casa En Los Lagos Moderna Y Funcional. Con 5 Dormitorios Más Servicio. Tiene Losa Hasta En La Galería. Cerramiento Reiki, Piscina De 10x4 Con Hidro Y Climatizada. (opción Amoblada)",560000,7,6,300,GBA Norte,Tigre,2025-12-17,1867
Gran Casa A Lago Central En Isla Del Este (dueño Directo),620000,10,5,350,GBA Norte,Tigre,2025-12-17,1771
Casa En Venta Barrio Santa Maria De Tigre,655000,8,5,369,GBA Norte,Tigre,2025-12-17,1775
"Casa  En Venta Ubicado En Lagos Del Norte, Don Torcuato, Tigre",670000,6,5,302,GBA Norte,Tigre,2025-12-17,2219
Casa En Venta En Los Carpinchos Nordelta Con Piscina,680000,7,5,308,GBA Norte,Tigre,2025-12-17,2208
Casa A La Laguna En San Gabriel,680000,7,5,285,GBA Norte,Tigre,2025-12-17,2386
Venta Casa En San Marco. Con Renta,690000,5,6,420,GBA Norte,Tigre,2025-12-17,1643
Venta Casa A La Laguna Barrio San Sebastian A1,699000,8,6,300,GBA Norte,Tigre,2025-12-17,2330
"Casa Venta Al Lago En Los Alisos, Nordelta",830000,7,3,320,GBA Norte,Tigre,2025-12-17,2594
"Venta Casa 3 Dormitorios Las Caletas, Nordelta",850000,6,5,444,GBA Norte,Tigre,2025-12-17,1914
"Casa En Venta Al Agua, Excelente Vista, Los Alisos Nordelta-tigre!",880000,4,4,420,GBA Norte,Tigre,2025-12-17,2095
"Espectacular Casa A La Laguna En Uno De Las Barrios Más Selectos Y Consolidados De Zona Norte, Con Seguridad 24 Hs. Y Una Laguna Central Navegable De Aprox. 60 Hectáreas, Diseñado Con Islas Y Puentes",1140000,11,5,320,GBA Norte,Tigre,2025-12-17,3562
Hermosa Casa En Venta En Barrio El Golf Nordelta,1780000,8,7,540,GBA Norte,Tigre,2025-12-17,3296
"Casa En Venta En El Barrio La Isla Nordelta-tigre, Gran Vista Al Lago Central. Detalles De Categoría!!!",1850000,5,7,576,GBA Norte,Tigre,2025-12-17,3212
Espectacular Casa En Venta Al Agua En Santa Barbara,1900000,4,5,458,GBA Norte,Tigre,2025-12-17,4148
"Casa En Venta En El Yacht, Nordelta Con Salida Al Rio, Moderna Y De Categoría",2200000,6,6,480,GBA Norte,Tigre,2025-12-17,4583
"Casa En Venta Al Río En El Yacht, Nordelta",2500000,7,5,540,GBA Norte,Tigre,2025-12-17,4630
"Casa En Venta Y Alquiler Al Río En El Yacht, Nordelta",2500000,7,6,550,GBA Norte,Tigre,2025-12-17,4545
Casa A Estrenar De 7 Ambientes En El Barrio Los Puentes. Nordelta.,3500000,7,6,550,GBA Norte,Tigre,2025-12-17,6364
Se Vende Casa Con Dos Dormitorios En Olivos,110000,4,1,55,GBA Norte,Vicente Lopez,2025-12-17,2000
Casa De 3 Ambientes Venta Carapachay Cochera,137000,3,1,71,GBA Norte,Vicente Lopez,2025-12-17,1930
Casa 3 Amb C/ Local En Florida Oeste,158000,3,1,130,GBA Norte,Vicente Lopez,2025-12-17,1215
Casa En Lote Propio - Apta Crédito - 3 Ambientes + Escritorio Ó 3º Dormitorio - Patio - Parrilla - Olivos Rugby - Excelente Ubicación Y Estado,179000,4,2,119,GBA Norte,Vicente Lopez,2025-12-17,1504
"Vendo Casa En Florida, Vicente Lopez",198000,4,2,97,GBA Norte,Vicente Lopez,2025-12-17,2041
Casa 5 Ambientes En Venta En Carapachay,205000,5,2,160,GBA Norte,Vicente Lopez,2025-12-17,1281
Casa A La Venta En Olivos Con Jardín - 2 Dormitorios,220000,3,1,87,GBA Norte,Vicente Lopez,2025-12-17,2529
Casa En Venta En Munro,265000,7,3,363,GBA Norte,Vicente Lopez,2025-12-17,730
Dueño Directo Vende Casa/chalet En Olivos,280000,6,1,130,GBA Norte,Vicente Lopez,2025-12-17,2154
Venta 2 Casas Entrad.indep S/lote 300m2 Florida,285000,5,2,150,GBA Norte,Vicente Lopez,2025-12-17,1900
Casa 4 Ambientes Vicente Lopez Barrio Parque,285000,5,2,218,GBA Norte,Vicente Lopez,2025-12-17,1307
"Casa En Venta Con Departamento En Planta Alta, Todo A Reciclar, En Florida/vte. López",285000,8,2,218,GBA Norte,Vicente Lopez,2025-12-17,1307
Venta De Casa 6 Ambientes En La Lucila,295000,6,3,168,GBA Norte,Vicente Lopez,2025-12-17,1756
Casa En Venta En Olivos Con Jardín Y Cochera,298000,4,1,163,GBA Norte,Vicente Lopez,2025-12-17,1828
Casa Venta Vicente Lopez 5 Ambientes Cochera,300000,5,2,140,GBA Norte,Vicente Lopez,2025-12-17,2143
Casa En Venta En Olivos,310000,4,2,105,GBA Norte,Vicente Lopez,2025-12-17,2952
Casa En Planta Baja En Olivos Ideal Para Reciclar,318000,3,1,177,GBA Norte,Vicente Lopez,2025-12-17,1797
Casa Venta Olivos 5 Ambientes Jardin Cochera,335000,5,3,171,GBA Norte,Vicente Lopez,2025-12-17,1959
Casa En Venta De 5 Amb Y Gran Jardín Con Pileta En Villa Martelli,335000,5,2,200,GBA Norte,Vicente Lopez,2025-12-17,1675
Casa Venta 6 Ambientes Vicente López,350000,6,2,148,GBA Norte,Vicente Lopez,2025-12-17,2365
"Venta Casa 4 Ambientes Con Cochera, Quincho Y Jardin En Olivos. Apto Credito.",355000,4,2,233,GBA Norte,Vicente Lopez,2025-12-17,1524
Venta De Casa De 4 Amb C/ Cochera Y Jardin,370000,4,2,178,GBA Norte,Vicente Lopez,2025-12-17,2079
Casa En Olivos En Venta Zona Quinta Presidencial 4 Dormitorios,379000,5,4,254,GBA Norte,Vicente Lopez,2025-12-17,1492
"Casa En Venta En Olivos, Excelente Estado, Quincho,  Parrilla Y Pileta, Cerca De Centro Comercial.",380000,5,2,150,GBA Norte,Vicente Lopez,2025-12-17,2533
