titulo,precio,ambientes,banos,metros,zona,ciudad,fecha_scraping,precio_m2
Venta: Casa - 2 Dormitorios - Vista Al Lago Y Pileta - Apta Credito - Carlos Paz,135000,5,1,145,Córdoba,Punilla,2025-12-17,931
"Casa Venta En La Cumbre, Zona Centro Remodelada.",138000,4,2,108,Córdoba,Punilla,2025-12-17,1278
Chalet Con Increíble Vista A Las Sierras,140000,5,3,167,Córdoba,Punilla,2025-12-17,838
"Casa En Venta 2 Dormitorios La Cumbre, Apto Crédito.",148000,3,1,116,Córdoba,Punilla,2025-12-17,1276
"Casa En Venta, 3 Dormitorios, 2 Baños, Pileta, Barrio Cerrado Keoken. Tanti",150000,5,2,180,Córdoba,Punilla,2025-12-17,833
"Casa De Categoría En Venta, 2 Dormitorios, 2 Baños, Pileta, Villa Santa Cruz Del Lago",163000,4,2,158,Córdoba,Punilla,2025-12-17,1032
Dueño Vende. Casa 4 Amb. Villa Giardino. B° V. Gloria,189000,4,2,200,Córdoba,Punilla,2025-12-17,945
Casa 3 Dormitorios - Lomas Del Rey - Mayu Sumaj,190000,5,3,180,Córdoba,Punilla,2025-12-17,1056
"Venta Casa De Dos Dormitorios Cabalango, Punilla.",198000,3,1,130,Córdoba,Punilla,2025-12-17,1523
Casa En Venta 3 Dormitorios Una Planta Tejas Iv,200000,7,2,170,Córdoba,Punilla,2025-12-17,1176
Venta Casa En Villa Parque Siquiman Con Costa De Río.,225000,6,3,289,Córdoba,Punilla,2025-12-17,779
Venta Casa 4 Dormitorios En Villa Parque Siquiman Con Costa De Río.,225000,6,3,289,Córdoba,Punilla,2025-12-17,779
Complejo De 5 Cabañas Con Piscina Doble . 7556m2 De Terreno - Villa Giardino - Córdoba,249000,12,5,250,Córdoba,Punilla,2025-12-17,996
"Casa En Venta En  La Cumbre, A Estrenar Zona Golf.",255000,4,2,150,Córdoba,Punilla,2025-12-17,1700
"Casa En Venta 3 Dormitorios, Quincho Y Pileta.",275000,5,1,285,Córdoba,Punilla,2025-12-17,965
Casa En Venta - Nuevo Malagueño,284000,9,3,222,Córdoba,Punilla,2025-12-17,1279
"Hermosa Casa En Carlos Paz Golf, Luminosa Y Con Excelente Vista",370000,8,3,295,Córdoba,Punilla,2025-12-17,1254
Casa En Venta En La Cumbre 3 Dormitorios.,378000,6,3,681,Córdoba,Punilla,2025-12-17,555
Comlejo De Cabañas En Venta Sierras De Cordoba,429000,12,5,241,Córdoba,Punilla,2025-12-17,1780
Casa En Venta En Carlos Paz Golf Con Piscina,440000,8,2,350,Córdoba,Punilla,2025-12-17,1257
Tu Casa Propia Con Entrega En 12 Meses | Financiación,45000,3,2,80,Córdoba,Santa Maria,2025-12-17,562
Ideal Para Complejo De Cabañas En Anisacate!,98000,6,2,157,Córdoba,Santa Maria,2025-12-17,624
Casa En Venta 3 Dormitorios Con Escritura - Potrero De Garay,108000,4,2,120,Córdoba,Santa Maria,2025-12-17,900
"Vistas A La Montaña, Pileta. Casa En Potrero De Garay",125000,4,1,193,Córdoba,Santa Maria,2025-12-17,648
"Venta Casa En  Calle Cordoba 1333, Villa San Nicolas, Cordoba",159000,7,3,255,Córdoba,Santa Maria,2025-12-17,624
Hermosa Y Luminosa Casa De 2 Dorm Y 2 Baños En 2 Plantas. Tejas 4!!,171000,3,2,135,Córdoba,Santa Maria,2025-12-17,1267
Venta Duplex 3 Dormitorios  Y Escritorio Acquavista,185000,3,3,150,Córdoba,Santa Maria,2025-12-17,1233
Venta - Hermoso Duplex 3d 3b - Barrio Cerrado Aquavista!,195000,4,3,140,Córdoba,Santa Maria,2025-12-17,1393
"Casa En Venta Náutico Los Molinos, Valle Fantástico, Villa Ciudad De América",215000,5,2,148,Córdoba,Santa Maria,2025-12-17,1453
Casa En Venta En Nuevo Malagueño,240000,5,3,130,Córdoba,Santa Maria,2025-12-17,1846
Casa-3 Dorm-malagaño,240000,3,2,127,Córdoba,Santa Maria,2025-12-17,1890
Casa En Venta Valle Del Golf,260000,6,2,230,Córdoba,Santa Maria,2025-12-17,1130
Casa En Venta Nuevo Malagueño,268000,11,2,140,Córdoba,Santa Maria,2025-12-17,1914
Casa En  Venta De 2 Dormitorios En Las Cañitas Barrio Privado A Estrenar,275000,5,2,185,Córdoba,Santa Maria,2025-12-17,1486
Tejas Tres Casa En Venta 4 Dormitorios Uno En Planta Baja Apto Crédito,280000,6,4,220,Córdoba,Santa Maria,2025-12-17,1273
Casa En  Venta De 3 Dormitorios A Estrenar En Las Cañitas Barrio Privado,280000,5,2,188,Córdoba,Santa Maria,2025-12-17,1489
Casa En Ventas Las Cañitas Dos Dorm Una Planta,280000,7,2,285,Córdoba,Santa Maria,2025-12-17,982
Casa En Venta En  Las Cañitas Barrio Privado De 3 Dormitorios Con Pileta,280000,5,3,211,Córdoba,Santa Maria,2025-12-17,1327
Casa En Venta Barrio Las Canitas 3 Dormitorios A Estrenar,285000,4,2,175,Córdoba,Santa Maria,2025-12-17,1629
Las Cañitas Barrio Privado - Malagueño  - 3 Dorm (suite En Pb) - Escritorio,285000,4,3,178,Córdoba,Santa Maria,2025-12-17,1601
Casa En  Venta De 3 Dormitorios En Las Cañitas Barrio Privado,290000,6,3,224,Córdoba,Santa Maria,2025-12-17,1295
Casa En Venta En Cañitas Barrio Privado De 3 Dormitorios A Estrenar,290000,4,3,218,Córdoba,Santa Maria,2025-12-17,1330
Casa En Venta - Puerto Del Aguila Potrero De Garay,299000,4,3,221,Córdoba,Santa Maria,2025-12-17,1353
"Casa En Venta En Country Causana  3 Dormitorios, Pileta, Cochera Doble Y Escritura Apto Crédito",315000,6,2,320,Córdoba,Santa Maria,2025-12-17,984
Venta Casa 3 Dorm. En Barrio Privado Causana Con Escritura,325000,3,2,255,Córdoba,Santa Maria,2025-12-17,1275
Casa En  Venta  De  4 Dormitroios En Las Cañitas Barrio Privado -apta Credito,337000,6,4,280,Córdoba,Santa Maria,2025-12-17,1204
"Venta De Casa Las Cañitas, 4 Dormitorios",337000,6,3,280,Córdoba,Santa Maria,2025-12-17,1204
"Casa En Venta En Náutico Los Molinos, Valle Fantástico, Villa Ciudad América",355000,9,3,258,Córdoba,Santa Maria,2025-12-17,1376
En Venta Casa De Lujo En Barrio Las Cañitas - Malagueño,360000,5,2,370,Córdoba,Santa Maria,2025-12-17,973
"Venta Imponente Casa De Categoría A Estrenar En Barrio Cerrado  La Arbolada Hollywood , Malagueño",370000,7,3,310,Córdoba,Santa Maria,2025-12-17,1194
Venta Casa En Las Cañitas - Bomba Bomba!,380000,5,4,344,Córdoba,Santa Maria,2025-12-17,1105
Predio En Venta Sobre Ruta 5 - Villa Parque Santa Ana,449000,4,2,200,Córdoba,Santa Maria,2025-12-17,2245
Casa Venta En Valle Del Golf,475000,6,3,296,Córdoba,Santa Maria,2025-12-17,1605
Los Espinillos,480000,6,1,180,Córdoba,Santa Maria,2025-12-17,2667
"Casa En Venta Una Planta, 3 Dormitorios En Country Causana",590000,8,4,440,Córdoba,Santa Maria,2025-12-17,1341
"Venta - Exclusiva Casa De Lujo En Valle Del Golf, Malagueño",600000,7,3,500,Córdoba,Santa Maria,2025-12-17,1200
Se Vende Conjunto De 3 Casas Costa De Lago En Potrero De Garay- 778,790000,4,2,300,Córdoba,Santa Maria,2025-12-17,2633
Venta Oportunidad Casa A 15 Cuadras Centro Villa Carlos Paz,72000,4,1,70,Córdoba,Villa Carlos Paz,2025-12-17,1029
Casa En Venta En Sol Y Río Con Piscina Y Jardín,80000,3,1,70,Córdoba,Villa Carlos Paz,2025-12-17,1143
Venta: Casa - 3 Dormitorios - Patio-  Las Malvinas - Villa Carlos Paz,80000,5,1,112,Córdoba,Villa Carlos Paz,2025-12-17,714
Casa En Venta Con Pileta Apta Credito En Villa Carlos Paz,89000,4,2,98,Córdoba,Villa Carlos Paz,2025-12-17,908
Casa En Sol Y Rio - Carlos Paz 2 Dormitorios,95000,3,1,110,Córdoba,Villa Carlos Paz,2025-12-17,864
Oportunidad Única Venta Casa En Villa Del Lago Carlos Paz,114900,6,2,176,Córdoba,Villa Carlos Paz,2025-12-17,653
"Casa A Estrenar En Venta Apta Credito, Villa Carlos Paz",115000,4,2,115,Córdoba,Villa Carlos Paz,2025-12-17,1000
Venta: Casa - 2 Dormitorios 2 Baños - Villa Del Lago - Villa Carlos Paz,120000,3,2,150,Córdoba,Villa Carlos Paz,2025-12-17,800
Casa Duplex En Venta 3 Dormitorios En Villa Carlos Paz,123000,3,1,110,Córdoba,Villa Carlos Paz,2025-12-17,1118
"Venta: Casa - 3 Dormitorios - Pileta, Terraza, Patio, Cochera - Santa Rita - Villa Carlos Paz",130000,5,2,95,Córdoba,Villa Carlos Paz,2025-12-17,1368
"Casa En Venta, 2 Dormitorios, Pileta, Vista Al Lago. Villa Del Lago, Villa Carlos Paz",135000,4,1,143,Córdoba,Villa Carlos Paz,2025-12-17,944
"Casa En Venta, 2 Dormitorios, Pileta Climatizada, Quincho, Cochera. B° Costa Azul. Villa Carlos Paz",135000,4,1,163,Córdoba,Villa Carlos Paz,2025-12-17,828
Casa Con Parque Y Potencial  B° Miguel Muñoz  Carlos Paz,135000,6,2,110,Córdoba,Villa Carlos Paz,2025-12-17,1227
Venta Casa De 2 Dorm. Y Dpto De 1 Dorm. A 1 Cuadra Del Río - Carlos Paz,136000,3,2,146,Córdoba,Villa Carlos Paz,2025-12-17,932
Venta: Casa - 3 Dormitorios 2 Baños - Patio - Miguel Muñoz - Villa Carlos Paz,138000,6,2,130,Córdoba,Villa Carlos Paz,2025-12-17,1062
"Casa Mas Departamento En Venta, Villa Carlos Paz",140000,6,3,254,Córdoba,Villa Carlos Paz,2025-12-17,551
Venta: Casa - 2 Dormitorios - Cochera - Villa Domínguez - Villa Carlos Paz,158000,4,1,138,Córdoba,Villa Carlos Paz,2025-12-17,1145
Casa En Santa Rita Con Departamento,160000,4,2,190,Córdoba,Villa Carlos Paz,2025-12-17,842
"Venta: Casa - 3 Dormitorios 2 Baños - Patio, Pileta Y Cochera - Santa Rita - Carlos Paz",160000,5,2,190,Córdoba,Villa Carlos Paz,2025-12-17,842
Venta: Casa + Departamento - 3 Dormitorios - Pileta - Malvinas - Carlos Paz,160000,7,2,175,Córdoba,Villa Carlos Paz,2025-12-17,914
"Casa En Venta Villa Carlos Paz, Entorno Maravilloso!!!!",165000,4,2,171,Córdoba,Villa Carlos Paz,2025-12-17,965
Casa En El Centro Villa Carlos Paz Con Departamento,170000,6,3,180,Córdoba,Villa Carlos Paz,2025-12-17,944
"Bella Casa En Venta En Villa Carlos Paz, Con Pileta, Bº Villa Del Lago, Residencial",174000,4,2,155,Córdoba,Villa Carlos Paz,2025-12-17,1123
Venta Casa + Departamento Con Pileta En José Múñoz,187000,6,2,170,Córdoba,Villa Carlos Paz,2025-12-17,1100
Casa En Venta 3 Dorm. Parque Y Quincho  Carlos Paz,188000,6,3,185,Córdoba,Villa Carlos Paz,2025-12-17,1016
Casa Centro De Carlos Paz,210000,6,3,187,Córdoba,Villa Carlos Paz,2025-12-17,1123
Casa En Venta En Carlos Paz - 3  Dormitorios - Pileta - Escritura,215000,3,3,200,Córdoba,Villa Carlos Paz,2025-12-17,1075
Casa En Costa Azul,220000,10,3,158,Córdoba,Villa Carlos Paz,2025-12-17,1392
"Hermosa Casa En Barrio Becciu , Pileta , Gas, Cochera Recibe Menor Y Vehiculo",225000,6,2,167,Córdoba,Villa Carlos Paz,2025-12-17,1347
Villa Del Lago En Carlos Paz Toda En Planta Baja Con Vistas Increibles,230000,2,3,240,Córdoba,Villa Carlos Paz,2025-12-17,958
"C249 - 2 Casas + Departamento, Sobre Av Cárcano",235000,14,3,390,Córdoba,Villa Carlos Paz,2025-12-17,603
Casa En Venta En Villa Carlos Paz,240000,7,6,389,Córdoba,Villa Carlos Paz,2025-12-17,617
Casa En Carlos Paz Amoblada - Hermosa Vista,250000,6,3,300,Córdoba,Villa Carlos Paz,2025-12-17,833
Casa En Venta 2 Dormitorios En Altos De Carlos Paz,255000,7,2,220,Córdoba,Villa Carlos Paz,2025-12-17,1159
Casa En Las Sierras De Carlos Paz · Con Pileta Y Cochera · Patio · Luminoso · Vista A Carlos Paz · Venta,259500,9,3,250,Córdoba,Villa Carlos Paz,2025-12-17,1038
"Casa En Venta En Villa Carlos Paz, Muy Amplia 3 Dorm, Pileta, Parque-",264000,3,2,255,Córdoba,Villa Carlos Paz,2025-12-17,1035
"Casa De Categoría, 3 Dormitorios, Mas Departamento, Pileta, Villa Carlos Paz, Villa Del Lago",289000,6,3,299,Córdoba,Villa Carlos Paz,2025-12-17,967
Casa En Venta Costa Azul Villa Carlos Paz-,295000,4,3,379,Córdoba,Villa Carlos Paz,2025-12-17,778
"Venta Casa 3 Dormitorios, 3 Baños, Pileta, Cochera. Villa Domínguez, Villa Carlos Paz",300000,6,3,264,Córdoba,Villa Carlos Paz,2025-12-17,1136
Hermosa Casa En Venta Alto De Carlos Paz,330000,8,3,202,Córdoba,Villa Carlos Paz,2025-12-17,1634
"Casa En Venta, Bajada Al Lago, 4 Dormitorios, 3 Baños, Pileta. Villa Del Lago, Villa Carlos Paz",350000,8,3,309,Córdoba,Villa Carlos Paz,2025-12-17,1133
Se Vende Casa Sobre El Lago En Villa Carlos Paz,639000,12,4,590,Córdoba,Villa Carlos Paz,2025-12-17,1083
Casa Premium En Costa Azul  513 M2 Cubiertos Con Pileta,650000,12,4,513,Córdoba,Villa Carlos Paz,2025-12-17,1267
"Casa En Venta De Lujo, 5 Dormitorios, Pileta, Quincho, Cochera, Vista Al Lago, Categoría.",950000,10,6,590,Córdoba,Villa Carlos Paz,2025-12-17,1610
Exclusiva Casa En Villa Del Lago.,1250000,7,6,629,Córdoba,Villa Carlos Paz,2025-12-17,1987
Casa En Venta - Country Mi Campo - Loma Verde - Escobar - 200 M2,58000,3,1,80,GBA Norte,Escobar,2025-12-17,725
"Casa Muy Luminosa En Club Coba, Frondosa Arboleda",58000,2,1,80,GBA Norte,Escobar,2025-12-17,725
Barrio Privado - El Canton,79000,2,4,710,GBA Norte,Escobar,2025-12-17,111
"Casa Impecable De 5 Ambientes , A 200 Mts De Panamericana , En Barrio Cerrado",98000,5,2,115,GBA Norte,Escobar,2025-12-17,852
Casa En Venta Jardines De Escobar,104900,5,2,130,GBA Norte,Escobar,2025-12-17,807
Casa En Venta - 3 Habitaciones - Terreno De 540m2 - Cubierto 80mts2 - Semi Cubierto 30mts2,115000,4,2,82,GBA Norte,Escobar,2025-12-17,1402
Casa En Venta  4 Amb. En Ingeniero Maschwitz,115000,4,2,85,GBA Norte,Escobar,2025-12-17,1353
"Dueño Vende Impecable Casa De 3 Amplios Ambientes, Super Luminosa, Con Jardin Y Cochera. Centro De Ing Maschwitz, Excelente Ubicación Y Entorno. Todos Los Servicios Conectados. Oportunidad !!!!!!",125000,3,1,120,GBA Norte,Escobar,2025-12-17,1042
Casa En Venta Club Privado Loma Verde Escobar Financiacion Propia,150000,10,4,380,GBA Norte,Escobar,2025-12-17,395
"Venta, Casa, San Sebastian, Area 13, Vista Al Hipico",155000,4,2,140,GBA Norte,Escobar,2025-12-17,1107
"Hermosa Casa En El Delta,  Barrio Aldea Del Lujan, En D. Luj",175000,4,3,180,GBA Norte,Escobar,2025-12-17,972
"Casa Lote Interno En Venta, Country San Sebastian",176000,5,2,175,GBA Norte,Escobar,2025-12-17,1006
Casa En  Barrio De La Musica Escobar,180000,3,1,125,GBA Norte,Escobar,2025-12-17,1440
"Oportunidad, Casa En Venta, San Sebastian, Area 5, 4 Ambientes",185000,4,2,138,GBA Norte,Escobar,2025-12-17,1341
Casa - Nautico Escobar,190000,6,2,165,GBA Norte,Escobar,2025-12-17,1152
Remanso | 5 Dorm | 6 Baños | Lote 1150m2 | 360m2 | Financio,200000,7,6,320,GBA Norte,Escobar,2025-12-17,625
Casa En Venta De 3 Dormitorios - Área 3 San Matías,225000,4,3,140,GBA Norte,Escobar,2025-12-17,1607
Venta Casa Con Pileta San Matias,227000,5,4,260,GBA Norte,Escobar,2025-12-17,873
"Casa, Venta, San Sebastian, Area 1, Vista A La Laguna",240000,4,2,135,GBA Norte,Escobar,2025-12-17,1778
"Casa  En Venta En Haras Santa Maria, Escobar, G.b.a. Zona Norte",255000,5,4,235,GBA Norte,Escobar,2025-12-17,1085
Casa En Venta El Cantón Barrio Puerto,270000,4,2,147,GBA Norte,Escobar,2025-12-17,1837
"Casa En Venta Con 3 Dormitorios, Oficina, Dependencia Y Pileta Climatizada Oportunidad",290000,5,4,208,GBA Norte,Escobar,2025-12-17,1394
Casa En Nautico Escobar - Acepta Financiación,290000,5,3,436,GBA Norte,Escobar,2025-12-17,665
Moderna Casa En El Cantón Puerto,298000,4,4,175,GBA Norte,Escobar,2025-12-17,1703
Casa En Alquiler O Venta En  Barrio Cerrado El Canton 5 Ambientes 4 Dormitorios Piscina - Escobar,299000,5,3,184,GBA Norte,Escobar,2025-12-17,1625
Dueño Vende Casas 252m2 Pileta. 6 Amb. 4 Baños. Jacuzzi. Lote Interno A Plaza. Ideal Familia O Inversión. Puertos Del Lago. Barrio Araucarias.,299000,6,4,252,GBA Norte,Escobar,2025-12-17,1187
Impresionante Casa A La Laguna En Venta Country San Sebastian,300000,5,4,160,GBA Norte,Escobar,2025-12-17,1875
Casa En Venta 3 Dormitorios - Excelente Estado - Fincas De Maschwitz,337000,4,4,250,GBA Norte,Escobar,2025-12-17,1348
Oportunidad!!! El Canton Golf - 326 - Casa 6 Dormitorios - Financio - Tomo Permuta,349000,8,6,240,GBA Norte,Escobar,2025-12-17,1454
"Casa  En Venta En San Sebastián, Área 8, Escobar, G.b.a. Zona Norte",365000,4,4,175,GBA Norte,Escobar,2025-12-17,2086
"Casa  En Venta  Con Salida A La Laguna, Estilo Neoclásico. En El Cantón.",379000,5,3,200,GBA Norte,Escobar,2025-12-17,1895
Casa Venta 4 Dormitorios Barrio San Matías Lote De 903 M2 Escobar,379500,5,3,207,GBA Norte,Escobar,2025-12-17,1833
"Casa  En Venta Ubicado En San Sebastian, Escobar, G.b.a. Zona Norte",380000,5,3,290,GBA Norte,Escobar,2025-12-17,1310
Casa En Venta En El Cantón Vista Abierta Al Golf,390000,5,4,200,GBA Norte,Escobar,2025-12-17,1950
"Casa  En Venta En Septiembre, Escobar, G.b.a. Zona Norte",580000,6,5,450,GBA Norte,Escobar,2025-12-17,1289
"Dueño Directo, Casa En Venta 6 Ambientes Puertos Del Lago-barrio Costas",619000,6,5,314,GBA Norte,Escobar,2025-12-17,1971
"Dueño Directo - Casa Sustentable. Barrio Costas, Puertos Escobar. Rodeada De Agua",620000,7,5,291,GBA Norte,Escobar,2025-12-17,2131
Casa En Venta 5 Ambientes Muelles,950000,5,4,280,GBA Norte,Escobar,2025-12-17,3393
Casa A Refaccionar 9x18 En Jose León Suarez,65000,4,1,80,GBA Norte,General San Martin,2025-12-17,812
Casa En Venta En Villa Ballester,80000,4,2,103,GBA Norte,General San Martin,2025-12-17,777
Casa En Venta En Villa José León Suárez,85000,4,2,118,GBA Norte,General San Martin,2025-12-17,720
Casa En Venta  Permuta Apto Credito,85000,3,1,100,GBA Norte,General San Martin,2025-12-17,850
"Casa 4 Ambientes, Parque, Parrilla Y Garage En San Martín",95000,4,2,135,GBA Norte,General San Martin,2025-12-17,704
Casa  Venta 3 Ambientes José León Suarez,96900,3,2,100,GBA Norte,General San Martin,2025-12-17,969
Venta Casa 3 Amb Villa Ballester Pileta Terraza,100000,3,1,80,GBA Norte,General San Martin,2025-12-17,1250
Casa Remodelada Con Posibilidad Comercial Cercanía Escolar.,105000,3,2,90,GBA Norte,General San Martin,2025-12-17,1167
Chalet Bajo De Precio!!! Oportunidad Villa Lynch,105000,4,1,131,GBA Norte,General San Martin,2025-12-17,802
Duplex 3 Ambientes Con Cochera En Villa Ballester Apto Credito,109000,3,1,67,GBA Norte,General San Martin,2025-12-17,1627
Casa 4 Ambientes Con Gran Parque En Villa Ballester,114000,4,2,160,GBA Norte,General San Martin,2025-12-17,712
Venta Casa 4 Ambientes Jardin Pileta Parrilla Cochera En San Martin,115000,4,3,70,GBA Norte,General San Martin,2025-12-17,1643
Casa  Apto Credito San Martin Inversion Refaccion,116999,3,1,80,GBA Norte,General San Martin,2025-12-17,1462
"Casa Tres Ambientes Con Patio, Parrilla Y Terraza",120000,3,1,116,GBA Norte,General San Martin,2025-12-17,1034
Venta Casa 3 Aambientes Lote Propio En Villa Lynch,125000,3,1,95,GBA Norte,General San Martin,2025-12-17,1316
Casa En Venta 4 Dormitorios San Andres Zona Golf Permuta,129000,7,2,159,GBA Norte,General San Martin,2025-12-17,811
Casa Con Galpón,135000,4,2,170,GBA Norte,General San Martin,2025-12-17,794
"Venta Casa 6 Ambientes Con Patio, Quincho Y Cochera - Villa Ballester",139000,6,2,170,GBA Norte,General San Martin,2025-12-17,818
"Casa Multifamiliar En Venta En San Andres, San Martin.",140000,5,2,120,GBA Norte,General San Martin,2025-12-17,1167
Casa En Villa Ballester,145000,5,3,250,GBA Norte,General San Martin,2025-12-17,580
Casa 4 Amb. En San Andres Con Jardin - Lote Propio,148000,4,2,102,GBA Norte,General San Martin,2025-12-17,1451
Venta Casa 3 Ambientes Villa Ballester Con Pileta,149999,3,1,103,GBA Norte,General San Martin,2025-12-17,1456
"Venta - Casa Con 3 Viviendas De 3 Ambientes Y Taller - General San Martin, Zona Norte",150000,8,4,230,GBA Norte,General San Martin,2025-12-17,652
Duplex Venta Villa Ballester A Estrenar,155000,3,1,70,GBA Norte,General San Martin,2025-12-17,2214
Venta Casa 5 Ambientes Con Jardin Y Cochera En Jose León Suarez,160000,5,3,86,GBA Norte,General San Martin,2025-12-17,1860
Casa En Venta En Villa Lynch,170000,6,2,320,GBA Norte,General San Martin,2025-12-17,531
Casa En  Venta José León Suarez 4 Ambientes,174900,4,2,200,GBA Norte,General San Martin,2025-12-17,874
Venta - Casa + Monoambiente,175000,4,3,120,GBA Norte,General San Martin,2025-12-17,1458
Venta Casa 4 Ambientes Villa Maipu Con Jardin Y Cochera A Metros De Av. Illia,180000,4,1,145,GBA Norte,General San Martin,2025-12-17,1241
Venta Casa 5 Ambientes Con Taller San Martin,185000,5,3,311,GBA Norte,General San Martin,2025-12-17,595
Casa En Venta A Pocas Cuadras De La Estación.,185000,3,2,163,GBA Norte,General San Martin,2025-12-17,1135
Casa 4 Ambientes - San Martin Centro - Oportunidad,209000,4,2,183,GBA Norte,General San Martin,2025-12-17,1142
"Duplex A Estrenar 4 Amb.  Cochera, Jardin, Parrilla",210000,4,1,120,GBA Norte,General San Martin,2025-12-17,1750
Duplex 4 Ambientes Con Jardín En Villa Ballester - Residencias Aguer,210000,4,2,103,GBA Norte,General San Martin,2025-12-17,2039
Casa 7 Ambientes Con Jardin En Villa Ballester,210000,7,4,300,GBA Norte,General San Martin,2025-12-17,700
Venta Permuta Casa San Martin Centro,210000,6,3,159,GBA Norte,General San Martin,2025-12-17,1321
Casa En Venta En San Martín,240000,4,3,151,GBA Norte,General San Martin,2025-12-17,1589
Venta Casa 3 Dormitorios Villa Ballester Pileta Garage Jardin,260000,4,2,185,GBA Norte,General San Martin,2025-12-17,1405
"Casa - Venta - Doble Cochera - Lote Propio - Villa Ballester, San Martin",289000,6,3,182,GBA Norte,General San Martin,2025-12-17,1588
Venta Casa 4 Amb En San Martin Con Pileta Y Jardín,290000,4,1,163,GBA Norte,General San Martin,2025-12-17,1779
Venta Casa 5 Ambientes  Ballester Pileta Y Parque,293000,5,2,232,GBA Norte,General San Martin,2025-12-17,1263
Venta Casa Villa Ballester 4 Ambientes,314900,4,2,192,GBA Norte,General San Martin,2025-12-17,1640
Casa En General San Martin,350000,5,3,300,GBA Norte,General San Martin,2025-12-17,1167
Casa 4 Ambientes Piscina Ascensor Acep. Propiedad,400000,4,5,342,GBA Norte,General San Martin,2025-12-17,1170
Casa En Venta De 5 Ambientes En Villa Ballester,450000,5,4,353,GBA Norte,General San Martin,2025-12-17,1275
Mgm. Oportunidad! Venta Casa Tortuguitas Apta Credito,55000,3,1,62,GBA Norte,Malvinas Argentina,2025-12-17,887
Venta Casa 5 Amb Los Polvorines Terreno Grande,60000,5,1,110,GBA Norte,Malvinas Argentina,2025-12-17,545
Casa 3 Amb Venta Tortuguitas Sobre Dos Terrenos,63000,3,1,80,GBA Norte,Malvinas Argentina,2025-12-17,788
Venta Casa 5 Amb En Totuguitas + Dpto 2 Amb A Term,81500,5,2,112,GBA Norte,Malvinas Argentina,2025-12-17,728
Casa Venta Los Polvorines,82000,3,1,88,GBA Norte,Malvinas Argentina,2025-12-17,932
Casa En Venta En Los Polvorines,85000,3,1,75,GBA Norte,Malvinas Argentina,2025-12-17,1133
Casas Multifamiliar En Venta - Villa De Mayo,110000,6,3,170,GBA Norte,Malvinas Argentina,2025-12-17,647
"2 Casas Sobre Un Mismo Lote En Barrio El Chelito De Tortuguitas (ruta 8, Km 39)",115000,6,2,80,GBA Norte,Malvinas Argentina,2025-12-17,1438
Casa En Los Polvorines,124900,4,1,232,GBA Norte,Malvinas Argentina,2025-12-17,538
Duplex 4 Amb Zona Los Polvorines Malv Arg Apto Credito,125000,4,2,133,GBA Norte,Malvinas Argentina,2025-12-17,940
Casa 3 Ambientes Venta Parque Alvear 1 Tortuguitas,129900,3,1,85,GBA Norte,Malvinas Argentina,2025-12-17,1528
Casa En Venta En Villa De Mayo Malvinas Argentinas,130000,4,2,140,GBA Norte,Malvinas Argentina,2025-12-17,929
"Casa  En Venta En Yei Pora, Tortuguitas, Malvinas Argentinas",140000,4,2,220,GBA Norte,Malvinas Argentina,2025-12-17,636
Casa En Venta Los Polvorines,140000,4,2,90,GBA Norte,Malvinas Argentina,2025-12-17,1556
"Excelente Casa Quinta En La Mejor Ubicación Del Barrio Parque Alvear I, En Cercanía A Los Accesos A Tortuguitas, Centros Comerciales Y Medios De Transporte",145000,5,3,120,GBA Norte,Malvinas Argentina,2025-12-17,1208
Venta Casa 4 Ambientes Con Pileta  Los Polvorines,167000,4,1,165,GBA Norte,Malvinas Argentina,2025-12-17,1012
Venta Casa 4 Ambientes  Con Pileta  Tortuguitas,230000,4,2,251,GBA Norte,Malvinas Argentina,2025-12-17,916
"Excelente Casa Quinta En Barrio Carumbe A 1 Cuadra De Av Principal En Tortuguitas Y 6 De La Estacion Y Centro Comercial, Estado Impecable En General",240000,6,3,200,GBA Norte,Malvinas Argentina,2025-12-17,1200
Casa Venta 3 Dormitorios Barrio Los Olivares Lote De 300 M2 Pilar,249000,4,2,146,GBA Norte,Malvinas Argentina,2025-12-17,1705
Casa En Venta Sobre Lote De 3358 M2 En Ing. Sourdeaux,265000,7,3,422,GBA Norte,Malvinas Argentina,2025-12-17,628
Casa En Venta En Bº Santa Maria De Los Olivos. Malvinas.,270000,5,1,200,GBA Norte,Malvinas Argentina,2025-12-17,1350
"Casa  En Venta En Los Olivares, Pilar, G.b.a. Zona Norte",290000,5,5,180,GBA Norte,Malvinas Argentina,2025-12-17,1611
Casa En Santa María De Los Olivos,290000,4,2,200,GBA Norte,Malvinas Argentina,2025-12-17,1450
Casa Venta 4 Dormitorios Barrio Los Olivares Lote De 298 M2 Pilar,290000,6,4,171,GBA Norte,Malvinas Argentina,2025-12-17,1696
Venta Casa Barrio Cerrado Sta María De Los Olivos,299000,5,3,262,GBA Norte,Malvinas Argentina,2025-12-17,1141
Casa En Santa Maria De Los Olivos,299000,6,3,240,GBA Norte,Malvinas Argentina,2025-12-17,1246
Casa Venta 4 Ambientes En Santa Maria De Los Olivos Malvinas Argentinas Pilar Lote De 790 M2,320000,4,2,189,GBA Norte,Malvinas Argentina,2025-12-17,1693
Casa En Venta En Santa Maria De Los Olivos,320000,4,3,193,GBA Norte,Malvinas Argentina,2025-12-17,1658
Casa 4 Ambientes En Los Olivares.,320000,5,4,240,GBA Norte,Malvinas Argentina,2025-12-17,1333
"Casa 4 Amb. Con Amplio Lote, Piscina, Cochera Y Parrilla",355000,4,2,280,GBA Norte,Malvinas Argentina,2025-12-17,1268
Casa | Venta | Olivos Golf Club | 4 Dormitorios En Suite,430000,10,4,200,GBA Norte,Malvinas Argentina,2025-12-17,2150
"Casa  En Venta En San Jorge Village, Malvinas Argentinas, G.b.a. Zona Norte",450000,5,4,290,GBA Norte,Malvinas Argentina,2025-12-17,1552
Casa Venta 6 Ambientes En Santa Maria De Los Olivos Malvinas Argentinas Lote De 1097 M2,450000,6,5,290,GBA Norte,Malvinas Argentina,2025-12-17,1552
"Casa Chalet  En Venta En Santa María De Los Olivos, Malvinas Argentinas, G.b.a. Zona Norte",520000,6,4,301,GBA Norte,Malvinas Argentina,2025-12-17,1728
Venta Casa De 3 Dormitorios En El Olivos Golf Club Con Impcatante Vista Al Hoyo 11,795000,6,3,355,GBA Norte,Malvinas Argentina,2025-12-17,2239
Casa Venta 7 Ambientes En Olivos Golf Cc Malvinas Argentinas Lote De 1851 M2,850000,7,3,486,GBA Norte,Malvinas Argentina,2025-12-17,1749
Casa En  Venta - 5 Ambientes - San Jorge Village,1350000,8,4,550,GBA Norte,Malvinas Argentina,2025-12-17,2455
Excelente Casa En Venta En San Jorge Village.,1400000,9,6,483,GBA Norte,Malvinas Argentina,2025-12-17,2899
Oppel | Casa En Venta | Olivos Golf Club  Malvinas Argentina,2500000,6,6,900,GBA Norte,Malvinas Argentina,2025-12-17,2778
Casa En Venta - Olivos Golf Club,2500000,10,6,950,GBA Norte,Malvinas Argentina,2025-12-17,2632
"Casa En Venta En La Lonja Pilar, Oportunidad",49000,4,1,80,GBA Norte,Pilar,2025-12-17,612
Casa En Venta Barrio Casablanca-pilar Apto Credito,75000,4,1,60,GBA Norte,Pilar,2025-12-17,1250
Oportunidad Venta De Casa Pilar Centro,89000,5,3,120,GBA Norte,Pilar,2025-12-17,742
